{
  "$schema": "http://json-schema.org/draft-07/schema#",
  "title": "SetupCenterSkillSchema",
  "description": "Schema definition for Agent prompts, skills, and recipes in Vault",
  "type": "object",
  "required": ["id", "name", "description", "prompt"],
  "additionalProperties": false,
  "properties": {
    "$schema": { "type": "string" },
    "id": { "type": "string", "minLength": 1 },
    "name": { "type": "string", "minLength": 1 },
    "description": { "type": "string" },
    "author": { "type": "string" },
    "tags": { "type": "array", "items": { "type": "string" } },
    "prompt": { "type": "string" },
    "tools": { "type": "array", "items": { "type": "string" } },
    "updatedAt": { "type": "string" },
    "extensions": {
      "type": "object"
    }
  }
}
